,book,author,price
668,อาถรรพ์เบญจเพส,รวมนักเขียน,161.10 บาท
669,บทเพลงร่ายอสูร ล.2 (3เล่มจบ),Hayashi Kisara,130.50 บาท
670,บันทึกปริศนาปมมรณะ ล.1 ต.สาปแสงจันทร์,Cylinly,130.50 บาท
671,แยกอาฆาต ราชประสงค์,ข้าเจ้า,130.50 บาท
672,คืนบาปพรหมพิราม,สันติ เศวตวิมล,108.00 บาท
673,ฝันร้าย...ตายไม่ดี,รวมนักเขียน,134.10 บาท
674,เพื่อนตาย,SS.Nottee,117.00 บาท
675,ทางผีผ่าน,กริชอาคม,162.00 บาท
676,โรงเรียนหลอน ซ่อนวิญญาณ,รวมนักเขียน,180.00 บาท
677,Undead ศพลวงตาย,ปองวุฒิ,166.50 บาท
678,ศิลปฆาตกรรม 3,wadoiji,175.50 บาท
679,เพชฌฆาตคนสุดท้าย 2,เชาวเรศน์ จารุบุณย์,162.00 บาท
680,การิน ปริศนาคดีอาถรรพ์ คดีที่ 4 บทจบ : พิพิธภัณฑ์คนบาป (การ์ตูน),อัยย์,58.50 บาท
681,Carnival of Love เกมรักราตรีเลือด,RabbitRose,180.00 บาท
682,Milly Mall ห้างศพสินค้า,ปองวุฒิ,152.10 บาท
683,ศิลปฆาตกรรม 1,wadoiji,175.50 บาท
684,หมอพ(ล)าย หมอเจ็บ,ปิยพงษ์ สาครเย็น,108.00 บาท
685,เป๋ อกไก่ วิปริต อำมหิต ฆาตกรรม,สมเกียรติ พ่วงทรัพย์,157.50 บาท
686,ฆาตกรรมในคอนโด,ปราชญา ปารมี,142.20 บาท
687,เที่ยวบินมรณะ,นิชธารณ์,126.00 บาท
688,สวัสดี...นาทีมรณะ,กองบรรณาธิการ,161.10 บาท
689,Fakebook เน็ตเวิร์คชวนตาย,ปองวุฒิ,157.50 บาท
690,The Morgue ดับจิต เชือด อำมหิต,เซวิลล์,135.00 บาท
691,การินการ์ตูน24(คดี 10) บทแรก ต.ตุงหนังมน,อัยย์,58.50 บาท
692,สาวน้อยเกวลิน ตอน คลั่งดารา,อลินา,117.00 บาท
693,สาวน้อยเกวลิน ตอน จากตายจากเป็น,อลินา,108.00 บาท
694,อุโมงค์มาร,จินตวีร์ วิวัธน์(จินตนา ปิ่นเฉลียว),378.00 บาท
695,เสกอสุรกาย,จินตวีร์ วิวัธน์(จินตนา ปิ่นเฉลียว),270.00 บาท
696,Codename : Bloody Mary รหัสเลือดล่าสังหาร,Lilita,170.10 บาท
697,สังหรณ์ฆาตกร,นิชธารณ์,135.00 บาท
698,บ้านศิลาทราย,จินตวีร์ วิวัธน์(จินตนา ปิ่นเฉลียว),432.00 บาท
699,UNKNOWN ปริศนา-ชมรม-อาถรรพ์,Asietha,197.10 บาท
700,ภารกิจซาตาน,ปนาพันธ์,256.50 บาท
701,สาปศพนางฟ้า 3 ความงาม ซากศพ ฆาตกร,กันย์ & Dim-Sum Studio,170.10 บาท
702,นางแค้น (4 ทิศตาย),ภาคินัย,224.10 บาท
703,ผีทวงชีวิต,กริชอาคม,126.00 บาท
704,โรงเรียนอาถรรพ์ กับฝันมรณะ,มายเมธา,207.00 บาท
705,หมอดูยอดนักสืบ,กองบรรณาธิการ,148.50 บาท
706,Parasite ปรสิตสังหาร ล.3(เล่มจบ),Half-life,130.50 บาท
707,Clairvoyant จิตสัมผัสตาย,ปัณณ์,144.00 บาท
708,Malediction รักสาปส่ง,ปัณณ์,144.00 บาท
709,The Alternate พลิกปมแค้น สลับแผนฆาตกรรม,รตกร,157.50 บาท
710,กระจกล่าวิญญาณ : กำเนิดกระจกมายา,ชวลักษณ์,178.20 บาท
711,การิน BlaCX ปริศนาอาถรรพ์ 'สีดำ' 3,อัยย์/Black Tohfu,152.10 บาท
712,เล่นซ่อนผี,ปัณณ์,117.00 บาท
713,เรือนสาบสาง,อัณณ์,126.00 บาท
714,การิน ปริศนาคดีอาถรรพ์ ภาค 2 ล.3 เสียงสะท้อนบาป,อัยย์,161.10 บาท
715,Rouge เงาเลือด,โทชิโอธ คามาตะ,180.00 บาท
716,7 DOLLS กับปริศนาในสวนสนุก,อลิส เจ กอบแก้ว,162.00 บาท
717,GHOST TEST แบบทดสอบผี,Staying,197.10 บาท
718,มิติเร้น,จินตวีร์ วิวัธน์(จินตนา ปิ่นเฉลียว),198.00 บาท
719,สาปภูษา (ปกใหม่),พงศกร,378.00 บาท
720,วังไวกูณฑ์,จินตวีร์ วิวัธน์(จินตนา ปิ่นเฉลียว),378.00 บาท
721,Fake-Lie-Die : Fake เสแสร้ง แกล้ง ตาย,เมธวิน,188.10 บาท
722,การิน ปริศนาคดีอาถรรพ์ คดีที่ 4 บทกลาง : พิพิธภัณฑ์คนบาป (การ์ตูน),อัยย์,58.50 บาท
723,พฤกษนิยาย,ส.พลายน้อย,288.00 บาท
724,อมุษยนิยาย,ส.พลายน้อย,207.00 บาท
725,การิน ปริศนาคดีอาถรรพ์ คดีที่ 5 บทแรก : สะพานข้ามอัสดงแห่งความตาย (การ์ตูน),อัยย์,58.50 บาท
726,ศาสตร์สะกดรอยผี 3,Staying,206.10 บาท
727,Fake-Lie-Die : Die เพื่อน (ตาย) ไม่ทิ้งกัน,เมธวิน,188.10 บาท
728,มนุษย์สังเคราะห์,จินตวีร์ วิวัธน์(จินตนา ปิ่นเฉลียว),216.00 บาท
729,การิน BlaCX ปริศนาอาถรรพ์ 'สีดำ' 2,อัยย์/Black Tohfu,152.10 บาท
730,มาแต่หิมพานต์,จินตวีร์ วิวัธน์(จินตนา ปิ่นเฉลียว),432.00 บาท
731,Cursed Sapphire มณีมนตรา,อาพัชรินทร์,197.10 บาท
732,การิน ปริศนาคดีอาถรรพ์ คดีที่ 1 บทจบ : คืนลอยกระทงสีเลือด (การ์ตูน),อัยย์,58.50 บาท
733,ศาสตร์สะกดรอยผี 2,Staying,197.10 บาท
734,Fake-Lie-Die : Lie ถ้าไม่อยากตายอย่าโกหก,เมธวิน,143.10 บาท
735,Winter เหมันต์สาบสูญ,ปองวุฒิ,139.50 บาท
736,Summer เกาะชะตาฆาต,ปองวุฒิ,148.50 บาท
737,การิน ปริศนาคดีอาถรรพ์ ภาค 2 ล.2 เชือกปะกำศพ,อัยย์,170.10 บาท
738,กึ่งหล้าบาดาล,จินตวีร์ วิวัธน์(จินตนา ปิ่นเฉลียว),432.00 บาท
739,อุปนิสาภพ,ปนาพันธ์ นุตร์อำพันธ์,207.00 บาท
740,สาปศพนางฟ้า 2 รัก ปรารถนา อาฆาต,กันย์ & Dim-Sum Studio,170.10 บาท
741,ชุดนาฏกรรมอำลาเล่ม1-2,,234.00 บาท
742,สาปศพนางฟ้า 1 ความรัก ริษยา ซากศพ,กันย์ & Dim-Sum Studio,179.10 บาท
743,คดีล่าคนเจ้าชู้,วินทร์ เลียววาริณ,175.50 บาท
744,Have No Choice เลือก-ทาง-ตาย 2,Nan-a (Alice) Hwang,143.10 บาท
745,Have No Choice เลือก-ทาง-ตาย 1,Nan-a (Alice) Hwang,134.10 บาท
746,บ้านเช่า...วิญญาณหลอน,ก้าวไกล,166.50 บาท
747,ศาสตร์สะกดรอยผี 1,Staying,197.10 บาท
748,Cursed Final คำสาปหลอนซ่อนวิญญาณ,เมธวิน,170.10 บาท
749,สาวน้อยเกวลิน 3 ตอนคลั่งดารา,อลินา,103.50 บาท
750,การิน ปริศนาคดีอาถรรพ์ คดีที่ 2 บทจบ : ขบวนแห่ภูต ป่าอาถรรพ์ (การ์ตูน),อัยย์,58.50 บาท
751,พรายพระกาฬ,จินตวีร์ วิวัธน์(จินตนา ปิ่นเฉลียว),535.50 บาท
752,ขุมทรัพย์โสมประภา,จินตวีร์ วิวัธน์(จินตนา ปิ่นเฉลียว),324.00 บาท
753,ชีวิตหลังความตาย,มายาวดี,112.50 บาท
754,Cursed 2 คำสาปหลอนโรงเรียนมรณะ,เมธวิน,143.10 บาท
755,เวียงร้อยดาว,บินละเว,216.00 บาท
756,เมย์ สาวน้อยพลังจิต,โซเฟีย,107.10 บาท
757,สาวน้อยเกวลิน 2 ตอนจากตายจากเป็น,อลินา,99.00 บาท
758,สาวน้อยเกวลิน 1 ตอนฆาตกรรมในแฟลต,อลินา,99.00 บาท
759,ของแถม (OBOS),เลออน,152.10 บาท
760,เครื่องรางดักฝัน (OBOS),NichtbraroN,161.10 บาท
761,คนเชิดหุ่น (OBOS),เนบิวลา,161.10 บาท
762,เงาวงกต (OBOS),แทน,152.10 บาท
763,เสียงหอนในห้องมืด HOWL IN THE DARK ROOM,อุเทน พรมแดง,175.50 บาท
764,กลลวงมรณะ  Revenge of Innocents,แนนซี่ เทย์เลอร์ โรเซนเบิร์ก,234.00 บาท
765,ร้านหลอนออนไลน์ 6 (จบ) ตอนอทศน,ข้าเจ้า,130.50 บาท
766,นักฆ่าบ้ากาม,สรจักร ศิริบริรักษ์,126.00 บาท
767,กระจกล่าวิญญาณ ภาคสัญญาเลือดแห่งมนต์ดำ,ชวลักษณ์,198.00 บาท
768,รหัสลับซีซาร์สะท้านโลก,ณัฐนันท์ สอนพรินทร์,180.00 บาท
769,การิน ปริศนาคดีอาถรรพ์ คดีที่ 6 บทแรก : กวีวิฬาร์อาฆาต (การ์ตูน),อัยย์,58.50 บาท
770,เพลิงเมฆา,แพรตะวัน,143.10 บาท
771,เล่ห์ร้ายมรณะ,ฟ้าใส ไอรดา,143.10 บาท
772,7 วันจองเวร : Friday ตอนท้าคนเป็น เห็นคนตาย,ภาคินัย,166.50 บาท
773,ตามล่าเกมมรณะ,ไพฑูรย์ เรือนทอง,224.10 บาท
774,เซ่อเป็นเสร็จ,ไพฑูรย์ เรือนทอง,157.50 บาท
775,เหม่ด่อยี นางพญาอาถรรพ์,มณีมัญช์,179.10 บาท
776,โรงครู,มาโนช นิสรา,108.00 บาท
777,พรายน้ำวน,อาริตา,270.00 บาท
778,7 วันจองเวร : Sunday ตอนห้องคลอดมรณะ,ภาคินัย,161.10 บาท
779,โรงฟอกมนุษย์,เขมปัญญ์ สิปปกรณ์,125.10 บาท
780,ปริศนาพันธุ์สองร่าง,วัชรากร,175.50 บาท
781,รหัสลับคนจูงหมา,กาบแก้ว,161.10 บาท
782,กลัว...?,ศิรวิน ฉินเฉลิมวงศ์,134.10 บาท
783,คุ้งตะเคียนดำ,ฆายณีย์,166.50 บาท
784,พิชิตแผนล่าทรชน,วสันต์ นิธิวรกุล,224.10 บาท
785,Disconnect เกมคร่าชีวิต,Compliated,107.10 บาท
786,โจรกรรมอมตะ,ญาณวุฒิ,170.10 บาท
787,ปมปริศนาเกาะมรณะ,วสันต์ นิธิวรกุล,152.10 บาท
788,เจตภูต...เจ้าหัวใจ,แรเงา,292.50 บาท
789,9 วันตาย,ไพฑูรย์ เรือนทอง,197.10 บาท
790,ภูต เล่ม 1,พ.จันทร์,198.00 บาท
791,ห้องเรียนที่ไม่ยอมเปิดรับ,จิโร่ อาคางาวะ,175.50 บาท
792,เพลงภูต(ข),นิดา,153.00 บาท
793,ปริศนาตลาดนัดราตรี,Tsunekawa Kotaro (ซึเนคาว่า โคทาโร่),157.50 บาท
794,คำพิพากษาของมหาสมุทร (Invisible Wave),ปราบดา หยุ่น,148.50 บาท
795,โรงเรียนปีศาจ,เหมาไถ,108.00 บาท
796,สัมผัสสยองของสาวแอร์ Six Sense,ใบตาล,121.50 บาท
797,ปิดเทอมหลอน 12 Trip ผีเฮี้ยน,อัลเบิร์ต กิ๊กก๊อก,121.50 บาท
798,ผีในคุก,น.ช.,130.50 บาท
799,โรงแรมผี,,90.00 บาท
800,เสือสมิง,,153.00 บาท
801,รากษสโฮเต็ล,สุธี ปิงสุทธิวงศ์,359.10 บาท
802,alone in the mountains,nichacs,180.00 บาท
803,บ่วงฆาต ราชดำเนิน,ศิวา สืบวงศ์สิน,242.10 บาท
804,เหล็กไหล (เล่ม 1-2),พนมเทียน,648.00 บาท
805,ในสวนหย่อม,nichacs,234.00 บาท
